{
  "schema_version": 1,
  "recommendation_id": "aaaaaaaa-aaaa-4aaa-8aaa-aaaaaaaaaaaa",
  "scorer_version": "mac-placement-v1",
  "created_at": 1785528001.0,
  "expires_at": 1785528060.0,
  "catalog_version": "2026.08.1",
  "catalog_digest": "sha256:1111111111111111111111111111111111111111111111111111111111111111",
  "request": {
    "logical_model_id": "model:deepseek-flash-v4",
    "recipe_id": "recipe:omlx-deepseek-flash-v4-mlx-4bit",
    "artifact_id": "artifact:deepseek-flash-v4-mlx-4bit",
    "engine": "omlx",
    "required_capabilities": [
      "chat/completions",
      "responses"
    ],
    "required_context_tokens": 32768,
    "required_concurrency": 1,
    "allowed_service_classes": [
      "primary",
      "opportunistic",
      "overflow"
    ]
  },
  "candidates": [
    {
      "pairing_display_name": "Studio Mac",
      "service_class": "primary",
      "basis": {
        "pairing_id": "28bfef6e-ce8d-4cd7-828e-79a3c99642eb",
        "credential_generation": 3,
        "inventory_instance_id": "4ea23b26-b02f-45bc-be1d-be47e40c1e76",
        "inventory_sequence": 42,
        "inventory_received_at": 1785528000.0,
        "basis_expires_at": 1785528060.0,
        "storage_location_id": "11111111-1111-4111-8111-111111111111",
        "storage_binding_generation": 1,
        "catalog_digest": "sha256:1111111111111111111111111111111111111111111111111111111111111111"
      },
      "eligible": true,
      "order": 1,
      "hard_gate_codes": [],
      "artifact_reuse": "verified_exact",
      "runtime_state": "compatible_verified",
      "estimated_download_bytes": 0,
      "estimated_peak_memory_bytes": 82033554432,
      "memory_headroom_bytes": 38225529856,
      "storage_headroom_bytes": 900000000000,
      "requires_local_approval": true,
      "power_policy": "preferred",
      "evidence": {
        "artifact": "measured",
        "hardware": "measured",
        "memory": "catalog_tested",
        "runtime": "catalog_tested",
        "storage": "measured"
      },
      "reasons": [
        {
          "code": "exact_artifact_reuse",
          "evidence_class": "measured",
          "observed_at": 1785527000.0,
          "explanation": "This exact signed artifact is already verified on the selected storage binding."
        },
        {
          "code": "local_approval_required",
          "evidence_class": "measured",
          "observed_at": 1785527997.0,
          "explanation": "The Mac owner must approve this remote install locally before download."
        },
        {
          "code": "memory_headroom_available",
          "evidence_class": "catalog_tested",
          "observed_at": 1785520000.0,
          "explanation": "The owner-defined memory budget retains conservative headroom."
        },
        {
          "code": "power_ac",
          "evidence_class": "measured",
          "observed_at": 1785527998.0,
          "explanation": "The Mac reports AC power without Low Power Mode."
        },
        {
          "code": "runtime_compatible_verified",
          "evidence_class": "catalog_tested",
          "observed_at": 1785527996.0,
          "explanation": "The exact runtime fingerprint is approved by the signed recipe."
        },
        {
          "code": "service_primary",
          "evidence_class": "conservative",
          "observed_at": 1785528000.0,
          "explanation": "This Mac is enrolled in the primary service class."
        },
        {
          "code": "storage_headroom_available",
          "evidence_class": "measured",
          "observed_at": 1785527997.0,
          "explanation": "The selected storage retains conservative post-download headroom."
        }
      ]
    },
    {
      "pairing_display_name": "Studio Mac",
      "service_class": "primary",
      "basis": {
        "pairing_id": "28bfef6e-ce8d-4cd7-828e-79a3c99642eb",
        "credential_generation": 3,
        "inventory_instance_id": "4ea23b26-b02f-45bc-be1d-be47e40c1e76",
        "inventory_sequence": 42,
        "inventory_received_at": 1785528000.0,
        "basis_expires_at": 1785528060.0,
        "storage_location_id": "22222222-2222-4222-8222-222222222222",
        "storage_binding_generation": 2,
        "catalog_digest": "sha256:1111111111111111111111111111111111111111111111111111111111111111"
      },
      "eligible": true,
      "order": 2,
      "hard_gate_codes": [],
      "artifact_reuse": "none",
      "runtime_state": "compatible_verified",
      "estimated_download_bytes": 72000000000,
      "estimated_peak_memory_bytes": 82033554432,
      "memory_headroom_bytes": 38225529856,
      "storage_headroom_bytes": 4220800000000,
      "requires_local_approval": true,
      "power_policy": "preferred",
      "evidence": {
        "artifact": "catalog_tested",
        "hardware": "measured",
        "memory": "catalog_tested",
        "runtime": "catalog_tested",
        "storage": "measured"
      },
      "reasons": [
        {
          "code": "local_approval_required",
          "evidence_class": "measured",
          "observed_at": 1785527997.0,
          "explanation": "The Mac owner must approve this remote install locally before download."
        },
        {
          "code": "memory_headroom_available",
          "evidence_class": "catalog_tested",
          "observed_at": 1785520000.0,
          "explanation": "The owner-defined memory budget retains conservative headroom."
        },
        {
          "code": "power_ac",
          "evidence_class": "measured",
          "observed_at": 1785527998.0,
          "explanation": "The Mac reports AC power without Low Power Mode."
        },
        {
          "code": "runtime_compatible_verified",
          "evidence_class": "catalog_tested",
          "observed_at": 1785527996.0,
          "explanation": "The exact runtime fingerprint is approved by the signed recipe."
        },
        {
          "code": "service_primary",
          "evidence_class": "conservative",
          "observed_at": 1785528000.0,
          "explanation": "This Mac is enrolled in the primary service class."
        },
        {
          "code": "storage_headroom_available",
          "evidence_class": "measured",
          "observed_at": 1785527997.0,
          "explanation": "The selected storage retains conservative post-download headroom."
        }
      ]
    }
  ]
}
